text,ref,translated,similarity_score
Ame kukua Ж’e Ж’ometЙ”wo ate Е‹u atso nya me le afisi woaЙ–i woЖ’e lЙ”lЙ”МѓtЙ”a le Е‹u.,The deceased's relatives can decide where to bury their loved one.,The relatives of the deceased can decide where their loved one is buried.,0.955078125
"Woade se Й–e V8/V6 tЙ”dziК‹uwo alo tЙ”dziК‹u Й–esiaЙ–e si Ж’e gbeЙ–iЙ–i sЙ” kple esia hehe nu, negbe mЙ”zЙ”zЙ” yi kЙ”Ж’enutowo me ko.","Towing of the V8/V6 vessels or any vessel of similar tone will be prohibited, except for trips to rural areas.","The towing of V8/V6 boats or any similar sounding boat will be prohibited, except for rural trips.",0.939453125
EsesбєЅna Е‹utЙ” be ame siwo Ж’oa wo Й–okuiwo Й–e teЖ’e vovovowo la nawЙ” nu aduadu.,It's quite hard to mix with people of different cultural beriefs.,It is very difficult for people who push themselves in different places to get along.,0.61572265625
Edze be na xe adzЙ”ga nenye be ne le asi tsam le anyigba sЙ”e aЙ–e dzi.,"You have the power to change the undesirable things around you, emphasizing personal agency and empowerment.",You deserve to pay taxes if you are trading on a flat property.,0.007671356201171875
"Nu siwo wozГЈna tsЙ” Ж’oa asa na asrГЈdЙ” nye atikewo, mu Й–aЙ–e nuwo Й–a kple ale si womate Е‹u aЖ’o asa na nuЙ–uЙ–u o.","Methods used to prevent malaria include medications, mosquito elimination and the prevention of bites.","The ingredients used to prevent malaria are medication, mud removal and the inability to avoid food.",0.81884765625
"NyЙ”nuvi dzetugbee wГІnye, gake ate Е‹u aЖ’o nu kplii, gake melЙ”Мѓ Й–e edzi kura o, togbЙ” be Й–evia vivina hГЈ la, elГ©a Й–oЙ–o Й–e edzi ЙЈesiaЙЈi, eye taЙ–ua megahea ta na dzila aЙ–eke vЙ› o.","She is a beautiful girl, but she is just too much trouble. She can talk, she can argue, but she never agrees. Her brother however is a sweet boy. He is always calm, and never causes his parents any headaches.","She was a pretty girl, but he could talk to her, but she didn't agree with him at all, although the child was sweet, he always kept order, and the headache no longer caused any parents headaches.",0.54296875
Dunyahela ate Е‹u anЙ” dunyaheha Й–esiaЙ–e me faa.,A politician is free to belong to any political party.,A politician is free to belong to any political party.,1.0009765625
poliswo le dЙ” wЙ”m kple bЙ”swo dzi kpЙ”lawo be yewoakpЙ” egbЙ” ЙЈeyiЙЈi didi aЙ–e.,Police are working with bus managers to find a long term solution.,polis is working with bus operators to find a long-term solution.,0.8037109375
DukЙ”mevi akpa gГЈtЙ” xЙ” edzi se be ate Е‹u awЙ”e eye wГІawЙ”e geЙ–e wu.,Most of the citizens believe in him that he can do it and do it more.,Most citizens believed he could and would do more.,0.6787109375
Asitsalawo adzЙ” ga na bЙ”lЖ’oЖ’ea tutu.,The business community will contribute funds for the construction of the stadium.,Businesses will fund the stadium.,0.89111328125
Kpekpe aЙ–e nЙ” anyi ku Й–e motsyЙ”nu si woama na sitsoЖ’edilaawo Е‹u.,There was a meeting about the face mask distribution to the refugees.,There was a meeting about the distribution of masks to the refugees.,0.96142578125
"EnЙ” Й–evi si gbЙ” wГІtso, eye wГІnЙ” kЙ”Ж’ea me, le Е‹uve me kple Ж’u si te Й–e Ж’u la Е‹u.","He lived a carefree childhood, spent in the village, in the bush, and on the nearby sea.","He was a child from whom he came, and he lived in the village, in the woods and by the sea.",0.70458984375
Eyae nye agbanЙ”amedzi be dziЙ–uЙ–ua nakpЙ” egbЙ” be atike vЙ”МѓЙ–iwo li le kЙ”dzi.,It's the government's responsibility to make sure there are drugs in hospitals.,It is the government's responsibility to ensure that drugs are available in hospitals.,0.9423828125
"KpЙ” nyuie, tsЙ” aК‹awЙ”nu vЙ”МѓЙ–iwo kpe Й–e fiafitЙ”wo Е‹u.","Be careful, thieves carry dangerous weapons along with them.","Be careful, add bad weapons to the thieves.",0.7080078125
Mele be nГ Ж’o nu le telefon dzi esime nГЁle К‹u kum o elabena wolГ©e le esi wГІku К‹u Е‹umaЙ–Й”Й–otЙ”e ta.,You should not talk on the phone while driving as He was arrested for driving recklessly.,You should not talk on the phone while driving because he was arrested for reckless driving.,0.98779296875
"Alesi atiglinyia Ж’e Е‹utigbalбєЅ sЙ”e nye be wГІaЙ–e nyЙ”nuvi Ж’ewuivi si le sЙ”hЙ›menЙ”ЙЈi Ж’e kЙ”nuwo me tom afia be, abe alesi lГЈa sesбєЅ ene la, nenemae wГІle be wГІasбєЅ Е‹u nenema ke le agbe me.","The relevance of the elephant skin is to show the teenage girl going through the puberty rites that, just as the meat is hard, that's how strong she should equally be in life.","The fit of the turtle skin is to show a teenage girl going through the rites of puberty that, as the animal is strong, she must be equally strong in life.",0.6435546875
"Esia fia kЙ”te be, FianyЙ”nua Ж’e dЙ”e wГІnye be wГІatia amesi dze tso fiaЖ’omea me","This clearly signify, it is the role of the Queenmother to select the qualify candidate from the royal family","This clearly means, it is the role of the Queen to choose the right person from the royal family",0.87939453125
"ЕЉutifafa, Й–oЙ–owЙ”wЙ” kple dedienЙ”nЙ” Ж’e gbedeasi ye sinimaa la nЙ” gbeЖ’ГЈ Й–em.","The film was preaching the word of peace, order and stability.","The film was preaching a message of peace, order and security.",0.96240234375
Ame geЙ–ewo xЙ” tso lГЈmeka falЙ›falЙ›a me le esi wokpЙ”e be lГЈmesбєЅnyawo le mГ­aЖ’e lГЈmesбєЅnyawo Е‹u,A good number of people have recovered from the coronavirus proving that we have a strong health sector,Many people have taken from the soft tissue in realizing that there are health issues with our health,0.32958984375
NuЙ–uЙ–u deЕ‹gЙ”wo le abe amegbetЙ”wo Ж’e agbe me.,Beans contain a high food value for human life.,Traditional food is like in human life.,0.39306640625
NyЙ”nu aЙ–ewo yia Е‹gЙ” wu ЙЈleti asieke siwo wofЙ” fufЙ”fЙ” Й–o la dometЙ” aЙ–ewo.,Some women go beyond or below the supposed nine months of their pregnancy.,Some women go beyond some of the five months of pregnancy.,0.87255859375
"EЙ–e srЙ”Мѓ esime wГІxЙ” Ж’e wuienyi eye eya hГЈ nЙ” dЙ” wЙ”m le ketekedzeЖ’ea, eye esi wГІxЙ” Ж’e wuiasieke la, edzi nyЙ”nuvi.","He married at the age of eighteen also working at the railway station, at the age of nineteen he had a daughter.","He married at the age of eighteen and she too was working at the station, and at the age of nineteen had a daughter.",0.82861328125
"Enye nunyala, eye wГІtea Е‹u wЙ”a nu Й–e dukЙ” sia Ж’e kplЙ”la Е‹u.",She is a wise and capable leader for this country.,"He is wise, and he can deal with the leader of this nation.",0.60302734375
Ekpena Й–e amegbetЙ” Ж’e susu Ж’e dЙ”wЙ”wЙ” nyuie Е‹u,It helps in the efficiency of the human mind,It helps in improving human cognition,0.873046875
"Le Ж’e 2020 me la, wowЙ” numekuku le sukudede kple sukudede Е‹u le Ghana afisia. When the investigation ended, some of the things that came to light are as follows.","In 2020, a survey of schooling and education was conducted here in Ghana. When the investigation ended, some of the things that came to light are as follows.","In 2020, there is a survey of education and education here in Ghana. When the investigation ended, some of the things that came to light are as follows.",0.96142578125
MГ­ate Е‹u aЖ’o nya ta tso esia me be ame Й–esiaЙ–e Ж’e ЙЈeyiЙЈi si wГІtsЙ”na kpЙ”a dzidzedze la le etЙ”xЙ›.,We can infer from this that each person's time to success is unique.,From this we can conclude that each personвЂ™s time to success is unique.,0.955078125
"NyateЖ’ee, kЙ”nu kple akpa siawo katГЈ Й–e FianyЙ”nu Dada Ж’e vevienyenye kple vevienyenye fia le AkantЙ”wo Ж’e dekЙ”nuwo kple hadomegbenЙ”nЙ” me. бєј, le AkantЙ”wo Ж’e hadomegbenЙ”nЙ” me la, FianyЙ”nu vidada geЙ–ewo Й–u fia kpe Й–e Fiawo Е‹u.","Indeed, all these customs and roles signify the importance and relevance of the Queenmother in Akans' culture and society. Yes, in the Akan society, many Queenmothers have reigned alongside Kings.","Indeed, all of these rituals and aspects reflect the importance and importance of the Queen Mother in Akan culture and society. Yes, in Akan society, many Queen mothers reigned alongside Kings.",0.91650390625
SЙ”hЙ› siawo Ж’e gГЈtЙ” le atike vЙ”МѓЙ–i zazГЈ me.,Majority of the youth are involved in drug abuse.,Most of these youths are involved in drugs.,0.84521484375
"AzЙ” hГЈ, aЙ–uЙ–Й”Й–Й”Й–Й” kple lЕ©hЙ› kpena Й–e ame Е‹u wГІЙ–ea aЙ–i Й–esiaЙ–e Й–a le Е‹utilГЈa me.","Also, rubbing the gums with a razor helps to remove any toxins from the body.","Also, brushing and shaving helps to remove any toxins from the body.",0.65869140625
"ЕЉkeke kЙ”kЙ”e siawo dzЙ”na le KwasiЙ–agbe, DzoЙ–a, BraЙ–a, Kuda, FiЙ–a kple MemleЙ–agbe.","These sacred days occurs on Sunday, Monday, Tuesday, Wednesday, Friday and Saturday.","These holy days occur on Sunday, Friday, Wednesday, Tuesday, Friday and Saturday.",0.921875
"Esi wГІnЙ” nu Ж’om le Kwame Nkrumah DzЙ”dzЙ”meЕ‹utinunya kple MЙ”МѓЙ–aЕ‹ununya YunivЙ›siti (KNUST) le woЖ’e Ж’e 40 xЙ”xЙ” le nusiwo wogbugbЙ” zГЈna me la, ekpЙ” be manyo ne wokpЙ” nuwЙ”na sia Ж’omevi eye woЕ‹e aЙ–aba Ж’u wo dzi o, ne wokpЙ” nusiwo tsi tre Й–e se Е‹u.","When he was speaking in the Kwame Nkrumah University of Science and Technology (KNUST) during their 40th anniversary in recycling, he saw that it wouldn't be nice if they see this kind of practices and ignored them, when they see things against the law happening.","Speaking at the Kwame Nkrumah University of Science and Technology (KNUST) on their 40th anniversary of recycling, he observed that it would not be good if this kind of practices were seen and ignored, if illegal materials were found.",0.83154296875
"Ж”ebubuЙЈiwo hГЈ ne wokpЙ” deti Ж’e aЕ‹gbawo le anyigba aЙ–e dzi la, efia be wole nya hem le anyigbaa Е‹u.","Other times, too, when palm fronds are seen on a piece of land, it indicates litigation over the land.","Other times, the sight of palm fronds on a piece of land indicates that the land is in dispute.",0.896484375
"Le nyateЖ’e me la, esime esia nЙ” edzi yim la, amewo nЙ” anyi, siwo dome Й–evia dada hГЈ nЙ”, gake wo dometЙ” aЙ–eke mete Е‹u Й–o aЙ–aЕ‹u na tagbЙ”sesбєЅtЙ” la be wГІadzudzЙ” Й–evia Ж’oЖ’o o.","In fact, while this was going on, there were people, including the child's mother, but none of them could advise the crazy man to stop beating the child.","In fact, while this was going on, there were people, including the childвЂ™s mother, but none of them could advise the bully to stop beating the child.",0.9052734375
Numekulawo Й–ee fia be tsinono Й–ea sukli Ж’e agbЙ”sЙ”sЙ” si le Е‹utilГЈ me dzi kpЙ”tЙ”na eye wГІkpЙ”a ame ta tso suklidЙ” me elabena nunyiamewo abe Vitamin kple bubuawo yЙ” tsi me fЕ©,Researchers have shown that drinking water reduces the amount of glucose in the body and protects against diabetes as water is full of nutrients like Vitamin and others,Researchers have shown that drinking water lowers blood sugar levels in the body and protects against diabetes because water is full of nutrients like Vitamins and others,0.96826171875
ZimenЙ”la la Й–e gbeЖ’ГЈe be yewoaЙ–o dedienЙ”nЙ”dzikpЙ”la bubuwo Й–e zГЈ me.,The chairman announced the deployment of more security forces in the night.,The chairman announced extra security forces would be deployed at night.,0.90185546875
WoaЙ–o xЙ”dzisasrГЈwo Й–e atikplЙ”Ж’ea hena dedienЙ”nЙ”.,A fence will be built around the staff quarters for security.,The bar will be equipped with rafters for safety.,0.337890625
MГ­ayi edzi alГ© Е‹ku Й–e tsaЙ–ilawo Ж’e teЖ’e bubu siwo le Ashanti nutoa me Е‹u le mГ­aЖ’e nusЙ”srЙ”Мѓ si gbЙ”na me.,we will continue look at the other tourist site in the Ahanti region in our next lesson.,We will continue to look at other tourist destinations in the Ashanti region in our next lesson.,0.7841796875
WogblЙ” be adzodada si Nana Agradaa zГЈ tsЙ” xЙ” ga le ameawo si la Й–o eЖ’e gbedoxЙ” me fifia.,It is said that the extortion used by Nana Agradaa to extort money from the people has now reached his temple.,The extortion used by Nana Agrada to extort money from the people is said to have now reached his temple.,0.96630859375
"Ne ГЁkpЙ” nusiawo katГЈ la, efia be no me kansa le nu gblбєЅm le wГІ susu Е‹u, KpЙ” wГІ Й–Й”kta enumake.","If you see all these, it means that breast cancer is killing your memory, See your doctor immediately.","If you see all these, it means that breast cancer is affecting your mind, See your doctor immediately.",0.86328125
"EhiГЈ be ame nate Е‹u atsЙ” nu siwo katГЈ nye kolГ©ra (le kpЙ”Й–eЕ‹u me, nudodowo, nudodowo kple kpluwo me) la aЖ’le ahawЙ” wo Й–okuiwo nyuie.","Proper disposal and treatment of all materials that may have come into contact with the feces of other people with cholera (e.g., clothing, bedding, etc.) are essential.","It is necessary to be able to buy and treat all cholera items (for example, clothes, utensils, and cups).",0.76318359375
Amewo dina ЙЈesiaЙЈi be nu nyuitЙ” na yewo Й–okuiwo nenye be edi be yewodzudzЙ” dЙ”wЙ”wЙ” hГЈ.,People always want the best for themselves even if it requires them to stop working.,People always want the best for themselves even if it means they stop working.,0.982421875
Wokpe amedzrowo be woade poliswo Ж’e dЙ”wЙ”Ж’ea.,Residents were invited to attend the grand opening of the police station.,Visitors are invited to attend the police station.,0.751953125
DziЙ–uЙ–ua le klalo be yeaЙ–e gbeЖ’ГЈ asi yeye siwo woatsЙ” akpe Й–e kokoo Ж’e asiwo Е‹u le kwasiЙ–a si gbЙ”na Ж’e Е‹keke gbГЈtЙ” dzi ne wodze ЙЈeyiЙЈi kple teЖ’e siwo woawЙ” kokoo la gЙ”me.,The government is ready to announce the new prices that would be added to the coco prices on the first day of the week coming when they launch the time and places for the cocoa.,The government is ready to announce new price additions to the cocoa prices on the first day of next week when the timing and locations of cocoa production are launched.,0.88525390625
Nutoa me Е‹gЙ”nЙ”lawo Й–oe be yewoakpЙ” ale si nutoa me tЙ”wo wЙ”a dЙ”e.,Local leaders have plans underway to ensure regional development .,Community leaders decided to see how the community worked.,0.39794921875
"Le esiawo katГЈ me la, NPP Ж’e SewЙ”takpekpe me tЙ”wo meda asi Й–e NDC Ж’e SewЙ”takpekpe me tЙ”wo Ж’e biabia dzi o. WoЙ–e eme be togbЙ” be yewodi be woaЙ–e Ganyawo Ж’e DЙ”dzikpЙ”la le dЙ”me hГЈ la, yewoazГЈ yewoЖ’e Е‹utetewo.","Within all this, the NPP Members of Parliament did not support NDC Members of Parliament request. They explained that although they want the Finance Minister to be sack but they will use their means","In all of this, the NPP MPs did not support the request of the NDC MPs. They explained that while they wanted the Finance Minister sacked, they would use their talents.",0.8818359375
"Ebia tso dziЙ–uЙ–ua si be wГІava kpe Й–e Bomaaman Е‹u, elabena wokplЙ”a wo yia afisiafi","He asked the government to come to the aid of Bomaaman, because they are taken away everywhere","He asked the government to come to the aid of Bomaaman, as they are taken everywhere",0.953125
"ЕЉku- bli, karЙ”t, koklozi, ayi, atadi, salmon, nagoti.","Eyes- maize, carrots, eggs, beans, pepper, salmon, sweet potato.","Eyes- rice, carrots, chicken, onions, peppers, salmon, beans.",0.892578125
AkЙ”ntabubudЙ”wЙ”Ж’ea awЙ” etЙ” sinua axe fetuawo Й–e game dzi.,The accounts office will do its best to pay the salaries on time.,The accounting department will do its best to pay the fees on time.,0.7470703125
"SЙ”hЙ› aЙ–ewo metea Е‹u xЙ”a dЙ” le sukunuwuЙЈi o, gake eda ga geЙ–e Й–e eЖ’e dЙ”wo me le nutoa me be wГІakpe Й–e nyЙ”nuwo Е‹u be woadzidze aЖ’emedЙ”wo Й–e edzi.","Some youths fail to get jobs after graduation, but he has injected more money into his businesses in the area to help women increase household income.","Some young people are unable to get a job after graduation, but she has invested heavily in her projects in the community to help women scale up household chores.",0.66650390625
"Ame aЙ–ewo mehiГЈ ale gbegbe be wometea Е‹u wЙ”a atikewЙ”nyawo o, eye zi geЙ–e la, woЙ–ea wo Й–e aga le woЖ’e aЖ’ewo me.",Some people are too poor to access medical services. They are usually quarantined in their homes.,"Some are so destitute that they cannot afford medical care, and are often isolated in their homes.",0.74462890625
"AzЙ” hГЈ, nyЙ”nu tsitsi aЙ–e tso fofoa Ж’e Ж’omea me xЙ” Й–evia eye wГІtsЙ” avЙ” ЙЈi tsyЙ” Й–evia dzi eye Й–evia tasi ayЙ” Е‹kЙ” si vifofoa di be yeatsЙ” ana Й–evia.","Also, an old woman from the family of the father recived the child and cover the child with white cloth and the aunty of the child will mention the name that the father wants to give it to the child.","Also, an old woman from the fatherвЂ™s family took the child and covered the child with a white cloth and the childвЂ™s mother would say the name the father wanted to give the child.",0.83740234375
Ametafatafae nye be woaxЙ” ga le ame aЙ–e si anukwaremaЙ–imaЙ–itЙ”e to ametafatafa alo ameflunyawo me.,Swindle is to get money dishonestly from someone by cheating or deceiving them.,Fraud is the act of dishonestly obtaining money from someone by fraud or deception.,0.72021484375
"SitsoЖ’edila aЙ–ewo mate Е‹u ade dЙ”wЙ”Ж’ea o, elabena ame geЙ–ewo dze dЙ” le ЙЈleti sia dzi.",Some refugees cannot attend the workshop because many have fallen sick this month.,"Some refugees will not be able to attend the workshop, as many have fallen ill this month.",0.9658203125
NutomekЙ”mitia kpЙ”a ame siwo le nutoa me Ж’e dedienЙ”nЙ” dzi.,The district committee is responsible for the security of the people in the area.,The district committee is responsible for the safety of the people in the district.,0.9287109375
MГ­ate Е‹u akpЙ” Е‹utete siawo Ж’e akpa gГЈtЙ” le ЙЈeyiЙЈi aЙ–ewo me.,Most of the skills can be acquired over a given period of time.,We can see most of these abilities at certain times.,0.3642578125
"Abe alesi hamemetsitsiwo gblЙ”e ene la, gbeЙ–eka le susu aЙ–e ta mГ­elЙ”Мѓa kpakpaluК‹ui Ж’e dzoa yiyi.","As the elders have said, one day for a reason we love to go to the quail fire.","As the elders said, one day for some reason we like to go to the butterfly fire.",0.70361328125
"TogbЙ” be atike aЙ–eke meli fifia o hГЈ la, blanuilГ©lenutsitikewo kpena Й–e ame mawo Е‹u be woanЙ” te Й–e enu vivivi.","Although there is no cure at present, antidepressants help such people to cope slowly.","Although there is currently no cure, antidepressants help such people to cope gradually.",0.98046875
Wona nЙ”vinyenyЙ”nu dzea dЙ”nЙ”a Ж’e Й–Й”ktawo gbЙ”.,My aunt was promoted to the position of senior doctor of the hospital.,My sister was admitted to the patient's doctors.,0.5537109375
"Esi afЙ”dzia Ж’oa Ж’u nЙ”a afima Е‹keke geЙ–e ta la, ame la sena le eЙ–okui me be agba le yeЖ’e ali kple axame me.","Because the solid waste gathers and remains there for days, the person feels heaviness behind the loins and the abdomen.","Because the foot builds up and stays there for days, the person feels heavy in the knees and sides.",0.5703125
Anyigbatata Ж’e akpa aЙ–ee nye ale si nГ de dzesi mЙ”nu siwo katГЈ ado dzidzЙ” na amee.,Mapping an area involves identifying all the boundaries for the area of interest.,Part of mapping is how to identify all the options that will be interesting.,0.53515625
Nu siawoe nye vifofo si aЖ’le wo dome akpa gГЈtЙ”.,These things is the father who will buy most of them.,These things are the father who will buy most of them.,0.97802734375
"Zi geЙ–e la, wozГЈa agbeli aЕ‹gbawo alo aЕ‹gba bubu si sЙ” na esia.",They usually use cassava leaves or a similar leaf for this.,"Usually, agbeli leaves or another suitable leaf is used.",0.7880859375
WoawЙ” kpekpe kpui aЙ–e atsЙ” adzro mЙ” si dzi sitsoЖ’edila siawo ato ayi Е‹gЙ”e me.,There will be a brief meeting to discuss the way forward for these refugees.,A brief meeting will be held to discuss the way forward for these refugees.,0.98828125
"Ke amekae nГЁnye be nГ gblЙ” na nunЙ”la la be eЖ’e aЙ–uwo biГЈ? Ne ГЁfe kplii hГЈ la, atsЙ” wГІ ade gaxЙ” me.","but who are you to tell the priest that his teeth are red? If you play with him too, he will put you in prison.","But who are you to tell the priest that his teeth are red? Even if you play with it, it will put you in jail.",0.9296875
"Nusi wogblЙ”na zi geЙ–e enye be, ne nyЙ”nua wЙ”e nenema la, ana vidzД© si le dЙ” me madze tugbe alo dze de ka o.","What they normally say is that, if the woman does that, it will make the unborn baby not to look beautiful or handsome.","The common claim is that, if the woman does so, it will make the unborn baby less attractive or worthy of a thread.",0.8359375
WoakpЙ” mЙ”nu siwo katГЈ wozГЈna tsЙ” wЙ”a dЙ” nyuie la dze sii.,All techniques used in improving production will be seen.,All methods of efficiency will be recognized.,0.7158203125
"Le afisia hГЈ la, mЙ”zЙ”la siwo tso Accra yi Tamale axe GH 240.00. Mina mГ­alГ© Е‹ku Й–e asi yeye siwo VIP JEOUN Й–e gbeЖ’ГЈe fifia Е‹u","Again, travelers from Accra to Tamale will pay GH?240.00. Lets look at the new prices VIP JEOUN has now announced","Again, passengers traveling from Accra to Tamale will pay GH 240.00. LetвЂ™s take a look at the new prices just announced by VIP JEOUN",0.93896484375
"ГЂЙ–o Е‹ku edzi be mГ­ekpЙ”e le sinima aЙ–ewo abe ""The weeping soul, The maid, Dumebi the dirty girl, Heart of a fighter""  kple sinima bubuwo me.","You will recall that we saw her in some movies like ""The weeping soul, The maid, Dumebi the dirty girl, Heart of a fighter"" and other movies.","You will remember that we saw him in some movies like ""The weeping soul, The maid, Dumebi the dirty girl, Heart of a fighter"" and other movies.",0.74462890625
Wode asi nubabla aЙ–e te Й–e nutome gГЈwo Ж’e dЙ”wЙ”wЙ” Е‹u,An agreement was signed for regional development .,An agreement was signed for the implementation of the districts,0.65576171875
"Zi geЙ–e la, hamemegГЈwo Й–ea nunya si le ""Ж’oЖ’o atraЙ–ii, gbГЈa ati"" me fiana.","The elders often express the wisdom of ""continuous hitting, breaks the wood.""","Elders often demonstrate the wisdom of ""constant knock, breaks wood.""",0.7744140625
Menye Й–eviwo katГЈe nГЁdina ne ГЁtsi o.,Not everything you want as a child you get when you grow old.,You donвЂ™t want all kids when you grow up.,0.50341796875
Ame sia ate Е‹u ata avЙ” sia atsЙ” aЙ–o dzesiwo Й–e amesiwo nЙ”a te Й–e eЕ‹u la Е‹u.,This person can wear this cloth to send signals to those who depend on him.,This person can paint this canvas to send signs to those who depend on it.,0.471435546875
Ele be Е‹utsuwo nate Е‹u awЙ” dЙ” sesД©e ale be woakpe Й–e yewoЖ’e Ж’omea Е‹u.,Men must work hard in order to support their families.,Men need to be able to work hard to support their families.,0.87744140625
Edze egЙ”me va se Й–e esime wГІnЙ” tЙ”dziК‹u aЙ–eke me o va se Й–e esime wГІnЙ” tЙ”dziК‹ua me.,She started without a having designate orphanage house until she owned one.,It went from being on no boat to being on the boat.,0.1270751953125
Ele be woadze agbagba Й–esiaЙ–e awЙ” wЙ”na kple nuЖ’o vovovowo le teЖ’e siwo le se nu alo le dziЙ–uЙ–ua Ж’e xЙ”wo me;,They must make every effort to hold various events and lectures in lawful places or buildings of the government;,Every effort should be made to hold a variety of events and talks in legal venues or in government buildings;,0.8154296875
"Le esi teЖ’e be woazГЈ aЕ‹gbawo le mЙ” xoxoa nu atsЙ” axlЙ”Мѓ nu amewo tso mЙ”Мѓ siwo me afЙ”ku le la Е‹u la, fifia wotea avЙ” dzД©wo Й–e mЙ”Мѓ vЙ”МѓЙ–iawo Е‹u.","Instead of the old method of using leaves to alert people about the deadly traps that have been set, strips of red cloth are now knotted around the harmful traps.","Instead of the old-fashioned use of leaves to warn people of dangerous devices, red cloths are now painted on the malicious devices.",0.7734375
