text,ref,translated,similarity_score
EЕ‹utinunyalawo kple dЙ”wЙ”Ж’egГЈ siwo ate Е‹u akpЙ” nutoa me dziЙ–uЙ–u Ж’e dЙ”wo gbЙ” le nutome la me.,The district has experts and bureaucrats who can handle local government projects.,The district has experts and bureaucrats capable of handling the functions of local government.,0.92724609375
"Le mГ­aЖ’e dzЙ”dzЙ”meЕ‹utinunya gЙ”mesese si le ta kekem ta la, womegatsЙ”a dЙ”lГ©le siwo xЙ”a ame me doa Ж’ome kple dzixЙ”se siwo do xoxo o, ke boЕ‹ wozГЈa atikewЙ”wЙ”mЙ”nu deЕ‹gЙ”wo tsЙ” daa dЙ”e.","Because of our expanding understanding of science, infectious diseases are no longer associated with outdated belief systems and are instead treated using cutting-edge medical procedures.","Thanks to our expanding scientific understanding, infectious diseases are no longer associated with outdated beliefs but are treated using advanced medical techniques.",0.962890625
GhanaitЙ” geЙ–ewo ahe to na ame ale gbegbe nenye be coronavirus le abe Ebola ene,Many Ghanaians would be so disciplined if coronavirus was like Ebola.,Many Ghanaians would be so punishing if coronavirus was like Ebola,0.9345703125
NutomeЖ’lelawo nye dugГЈ Ж’e teЖ’enЙ”lawo le woЖ’e nutoa me.,Resident district commissioners are representatives of the president in their district.,Community buyers are city representatives in their community.,0.406005859375
"Esi woЙ–e asi le eЕ‹u le gaxЙ” me le Ж’e 1966 me la, Dr.Ebenezer Ako-Adjei megakpЙ” gome le Ghana dunyahehe me abe alesi wГІwЙ”e tsГЈ ene o.","After his release from prison in 1966, Dr.Ebenezer Ako-Adjei no longer participated in Ghanaian politics as he had done before.","After his release from prison in 1966, Dr.Ebenezer Ako-Adjei was no longer as involved in Ghanaian politics as he had been in the past.",0.98291015625
WoЖ’e fia kЙ”kЙ”tЙ” enye Asante fia Dwaben fia Nana Yaw Sarpong nye wo vi atЙ”Мѓlia.,Their highest king is Asante king the king of Dwaben Nana Yaw Sarpong is their fifth child.,Their supreme king was the Asante king Dwaben king Nana Yaw Sarpong was their fifth child.,0.91943359375
"WoЖ’e kЙ”nyinyiwoe nye be woanЙ” fia vЙ”МѓЙ–i si nye Togbe Agorkoli (Agorkoli) te, eye ale be woate Е‹u asi le eЖ’e dziЙ–uЙ–u sesбєЅ la me ale be woawЙ” do aЙ–e le gli si Ж’o xlГЈ woЖ’e dua me la me.","Oral tradition has it that they lived under a wicked king, Togbe Agorkoli ( Agor Akorli), and in order to escape his tyrannical rule they had to create a hole in the mud wall that surrounded their town.","Their traditions were to live under the evil king Togbe Agorkoli (Agorkoli), and so that they could escape his harsh rule so as to make a hole in the wall surrounding their city.",0.83251953125
NЙ” Е‹udzЙ” Й–e ame si nГЁЙ–e asi le viwГІa Е‹u la Е‹u!,Be careful with the person you leave your child with!,Be careful who you let go of your child with!,0.84521484375
"Te Й–e amesiwo doa dzidzЙ” na wГІ Е‹u, eye nГ yi teЖ’e siwo ana nГ kpЙ” dzidzЙ”.","Approach those who make you happy, and go to places that make you feel happy.","Surround yourself with people who make you happy, and go places that make you happy.",0.8486328125
Womete Е‹u wЙ” Й–oЙ–o Й–e К‹uЙ–oЙ–oa Е‹u le ga sue si le wo si ta.,They failed to organize the transport because of the limited funds.,They could not arrange the transport due to limited funds.,0.89697265625
Ele be amewo nakpЙ” gome le asitsatsa me eye woana woaЖ’e gbe nanyo Й–edzi.,People should engage in business and improve their standards of living.,People need to participate in the market and improve their voice.,0.5830078125
"Le afisia hГЈ la, nu etЙ”Мѓliae nye koklolГЈ si woЙ–a.","Again, the third ingredient is cooked chicken.","Again, the third item is the grilled chicken.",0.7548828125
"Ne ГЁlia ati nyui aЙ–e si me atikutsetsewo le lae mГ­enaa tutu wГІ be nГ Е‹e, elabena wonya be ne edo nyuie la, yewoЖ’e gome anЙ” yewo si.","it is when you climb a good tree with fruits that we give you a push so pluck, because they know when it comes out good, they will have their share.","It is when you climb a good tree with fruit that we give you the push to harvest, because they know if it comes out well, they will have their share.",0.791015625
"Hekpe Й–e gadzraЙ–oЖ’ewo Е‹u la, afi kae nutoa me akpa gГЈtЙ” zГЈa ga le?","Besides banks, where do most locals borrow money from?","Besides banks, where does most of the community spend money?",0.69580078125
1. ЕЉutinyagbЙ”gblЙ”: Esia nye fefe Ж’omevi aЙ–e si ame tsitsiwo kple Й–eviwo siaa ate Е‹u awЙ”. Fefe sia Ж’omevi nyea fiбєЅsi me esime dzinu bliboa dzena zi geЙ–e,1. Storytelling: This is a type of game that can be play by both old and young. This type of game is mostly play in the evening when the full moon is visible,1. Storytelling: This is a type of game that can be played by both adults and children. This type of game takes place in the evening when the full moon is usually visible,0.96142578125
Wobia tso asitsalawo si be woalГ© lГЈmesбєЅnyawo Ж’e mЙ”fiamewo me Й–e asi hafi ate Е‹u anЙ” te Й–e dЙ”lГ©lea nu.,Market vendors were asked to follow the health guiderines to survive the pandemic.,Businesses are required to adhere to health guidelines to cope with the disease.,0.67431640625
"Hafi amewo nakpЙ” nunya le dЙ”wЙ”wЙ” kple mЙ”Мѓwo me la, kadodomЙ”nu kple alesi wonЙ”a agbee nЙ” AkantЙ”wo si.","Before people got wisdom in working with machines, the Akans had ways of communication and how they led their life.","Before humans developed intelligence and machinery, the Akan had a means of communication and a way of life.",0.8876953125
"TogbЙ” be dЙ”lГ©le sia mebЙ” Й–e ame geЙ–e me o hГЈ la, afЙ”ku le eme na amesiwo Е‹u dЙ”lГ©le sia le Е‹utЙ”.","Although this disease is rare in many people, it is very dangerous for those who have this disease.","Although this disease is rare in many people, it is very dangerous for those who have it.",0.99169921875
DukplЙ”la Ж’e kpeЙ–eЕ‹utЙ” si li fifia nye tiatiawЙ”ha Ж’e zimenЙ”la tsГЈ.,The current vice president previously served as chairman of the electoral commission.,The current vice president is a former chairman of the electoral commission.,0.9833984375
Wode se nЙ› tso afima be wГІaЙ–o dze kple Chelse Ж’e Ж’uЖ’oЖ’oa Ж’e dЙ”dzikpЙ”lawo le telefon dzi.,They instructed him from there to have a chat with the Chelse team managementon phone.,"From there, he was instructed to have a phone conversation with Chelsea's team management.",0.68994140625
"Ele be woabu dziЙ–uЙ–umegГЈwo Ж’e dzeЙ–oЙ–owo Е‹u vevie, elabena zi geЙ–e la, nyatakaka veviwo, mЙ”fiamewo alo mЙ”fiame vevi siwo dzi dziЙ–uЙ–ua le la gblЙ”m.","Official communication should be taken seriously, as it often conveys important information, instructions, or policies from authoritative sources.","Official conversations should be taken seriously, as they are often conveying important information, instructions or directives that the government is pursuing.",0.8330078125
Ж”eyiЙЈi didi: DЙ”meЙ–ui si nЙ”a anyi ЙЈleti ade alo esi wu nenema.,Long-term: Constipation that lasts for six months or more.,Chronic: Constipation lasting six months or more.,0.912109375
Ele be woadze agbagba akpЙ” kuxi tЙ”xЙ› siwo nyЙ”nuviwo doa goe le sukudede le dukЙ”a me gbЙ”.,Efforts need to be made to address the specific challenges faced by girls in accessing education in the country.,Efforts should be made to address the unique challenges girls face in attending school in the country.,0.9326171875
"Le nyateЖ’e me la, dЙ”lГ©le siawo ate Е‹u agblбєЅ nu le mГ­aЖ’e Е‹utilГЈ hГЈ Е‹u.",The reality is that these illnesses can actually harm our bodies as well.,"In fact, these diseases can also affect our body.",0.783203125
Alhaji Abubakari Alhassan Й–e kuku na dziЙ–uЙ–ua be ne sбєЅ eЖ’e sewo me le eЖ’e mЙ”zЙ”zЙ” kple galamsey me ale be woateЕ‹u alГ© kokoo kple eЖ’e nyawo me Й–e asi.,Alhaji Abubakari Alhassan has made a plea to the government that he should tightened his rules in his journey against galamsey so that they can maintained the cocoa and its issues.,Alhaji Abubakari Alhassan has appealed to government to tighten its rules in its travel with galamsey so that cocoa and its claims can be upheld.,0.85498046875
"Wogale wo dometЙ” aЙ–ewo zГЈm, gake womegale wo dometЙ” akpa gГЈtЙ” zГЈm o.","Some are still in use, but the majority are no longer in use.","Some are still in use, but most are not.",0.9677734375
Nufialaa dze dzeЙ–oЙ–o aЙ–e gЙ”me kple eЖ’e sukuviawo.,The teacher started a general conversation with her students.,The teacher started a conversation with her students.,0.9814453125
"NyЙ”nuviawo nЙ”a wo dada, si nye agbledela dovevienu Е‹utЙ” la gbЙ”.","The girls live with their mother, who is a very hardworking farmer.","The girls live with their mother, a very industrious farmer.",0.94775390625
"Le Ж’e alafa 16 lia Ж’e nuwuwu la, Ghana-dukЙ” akpa gГЈtЙ” nЙ” teЖ’e siwo yi egbea.","By the end of 16th century, most of the ethnic groups constituting the modern Ghanaian population had settled in their present locations.","By the end of the 16th century, most of Ghana was in places that go today.",0.74267578125
Rukia kple Asana Ж’e dЙ”wЙ”Ж’ea tsi nyuie eye wowЙ” Й–oЙ–o Й–e dЙ”a Е‹u ЙЈesiaЙЈi.,Rukaya and Asana's workspace was always neat and organized. They always made sure to put everything in its proper place.,Rukia and AsanaвЂ™s company has grown well and has always been organized.,0.6845703125
GadЙ”wЙ”la siwo le asitelefon dzi kpЙ”m la mekpena Й–e wo Е‹u le gadzЙ”dzЙ” ta o.,Mobile money agents are receiving less commission because of mobile money tax.,Cashiers handling mobile phones are not helpful due to cash collection.,0.41748046875
"Numekukuwo Й–ee fia gЙ”Мѓ hГЈ be, ame aЙ–ewo xЙ” abi vevie, esime wonЙ” agbagba dzem be yewoage Й–e eme.","Investigations even showed that, some people were severely injured, when they were straggling to get inside.","Investigations even revealed that, some people were seriously injured, while trying to get inside.",0.91943359375
"Ame siwo le Portland, si nye Oregon, si nye ""Portal Homowo kple VenyЙ”nuviwo Ж‘e ЕЉkekenyui "" (Portalland Homowo Ж‘e AgbalбєЅ GГЈ) la wЙ”e be yewoaЙ–u Е‹kekenyui le yewoЖ’e aЖ’emetЙ”wo gbЙ”.","Ga people living in Portland, Oregon host the ""Portland Homowo & Twins Festival"" to celebrate alongside their native counterparts.","The people of Portland, Oregon, the ""Portal Homos and Daughters Celebration "" (Portalland Homo Ledger) made it a point to celebrate at their household.",0.73095703125
"Le afisia hГЈ la, wotsЙ” woЖ’e kotokuwo eye wodzra woЖ’e tu siwo me tЙ”sisi Twi tsrЙ”Мѓe Й–o la Й–o.","Again, they took their sacks and kept their guns in which made river twi destroyed it.","Again, they carried their coats and prepared their guns which the river Twi had destroyed.",0.7099609375
Nu kae wГІle dziЙ–uЙ–u si le nutoa me kple susu be tsitsi Й–e dzi na va miaЖ’e nutoawo me?,What should be done by local government to develop their local areas?,What is the local government doing with the idea of вЂ‹вЂ‹increased growth in your communities?,0.765625
Ame tsitsiwo Ж’e xexlбєЅme sЙ” gbЙ” le sitsoЖ’edilawo dome.,There is a big percentage of older people among the refugees.,There is a high proportion of older people in the refugee population.,0.96875
Coronavirus le dzidzim Й–e edzi le Ghana Ж’e gaxЙ”wo me eye gamenЙ”lawo Ж’e lГЈmesбєЅ va zu nusi Е‹u amewo tsi dzi Й–o,There is a rising number of coronavirus cases in Ghana prisons and inmates health is becoming a public concern,The coronavirus is spreading in Ghana's prisons and the health of prisoners has become a concern,0.97607421875
Ame eve Ж’e Ж’uЖ’oЖ’o yia tsatsa le kЙ”Ж’ea Е‹u Е‹di sia Е‹di.,A two-person team is to patrol the village every morning.,A group of two goes for a walk around the village every morning.,0.7470703125
TЙ”dzisasrГЈa Ж’e dЙ”a wЙ”a tЙ”sisi gbogbo siwo le nutoa me Е‹udЙ”.,The dam project makes use of the numerous rivers in the area.,The dam project takes advantage of the many rivers in the area.,0.990234375
"Ne mГ­elГ© Е‹ku Й–e eЕ‹u nyuie la, ЙЈeyiЙЈi aЙ–e va yi la, BonotЙ”wo Ж’e nutoae nye esi woyЙ”na be AkantЙ”wo Ж’e habЙ”bЙ”.","If we look at it well, some time ago, the Bono community was the one called the Akan community.","If we look closely, once upon a time, the Bono community was the so-called Akan community.",0.95849609375
WodrЙ”Мѓa fЙ” nyЙ”nu aЙ–e le esi wГІnye lГЈ si mede o ta.,A woman was convicted for illegal possession of meat.,A woman is judged for being an inferior animal.,0.362060546875
"Le esia ta la, wokpЙ”e be woate Е‹u awЙ” Й–oЙ–oawo dzi.","In view of this, they realized that the arrangements could be implemented.","As a result, the plans were found to be implementable.",0.64501953125
DЙ”wЙ”Ж’e siwo le dzeЙ–oЙ–o me la Й–ua nyatakakadzraЙ–oЖ’e siwo le Mast,Mast sites are managed by the terecommunication companies.,Companies in conversation consume databases in Mast,0.4267578125
"WogblЙ” be yewomada asi Й–e Е‹utasбєЅnuwЙ”wЙ” aЙ–eke dzi o, woxlЙ”Мѓ nu be aЖ’o ame alo ame Ж’e Ж’uЖ’oЖ’o Й–esiaЙ–e si woakpЙ” be ele nuwЙ”na mawo tЙ”gbe wЙ”m la nu Ж’u eye woatsЙ” wo ade asi na sedzikpЙ”lawo.","They said they would not condone any act of violence, they warned that would round up any person or group of persons found engaging in such acts and hand them over to law enforcement agencies.","They said they would not condone any act of violence, warning that it would round up any person or group of persons found engaging in such acts and hand them over to law enforcement.",0.95166015625
ЕЉusбєЅ Ж’e К‹iК‹li Й–e sia Й–e ate Е‹u ana be GhanaitЙ”wo Ж’e maЙ–ifЙ”wo naК‹ГЈ.,Any power struggle can cause displacement of innocent Ghanaians.,Any power struggle could cause innocent Ghanaians to move.,0.88623046875
"EgblЙ” be, Й–oЙ–o sia nye dziЙ–uЙ–umegГЈwo kple dukplЙ”la Ж’e aЙ–aЕ‹uЙ–oha Ж’e mЙ”fiame si wole mЙ” kpЙ”m be adze egЙ”me le February me","He said that is, this process is the direction of the chief ministers and the presidential advisory board which is expected to start in February","The process, he said, is a directive of the cabinet and the presidential council which is expected to begin in February",0.85302734375
Agbagbadzedze be woaЙ–e asrГЈdЙ” Й–a la le edzi yim le LГЈmesбєЅnyawo GbЙ”kpЙ”ha Ж’e tatЙ” me,The efforts to eradicate malaria are underway headed by the Minister of Health,Efforts to eradicate malaria are taking place at the head of the Ministry of Health,0.94384765625
"WozГЈa numiemie siawo elabena exЙ”a ЙЈeyiЙЈi didi hafi buna keЕ‹keЕ‹ le anyigba aЙ–e dzi, ne wobuna kura gЙ”Мѓ hГЈ.","They use these plants because they take a long time to completely disappear from a piece of land, if they do at all.","These plants are used because it takes a long time to completely disappear from a landscape, if at all.",0.9052734375
"Le eЖ’e lЙ›ta si wotso afia nЙ› me la, Е‹utsu sia Ж’e afЙ”Й–eЙ–ea tsi tre Й–e Ekiti Гђeviwo Ж’e HabЙ”bЙ” Ж’e se si wowЙ” le Ж’e 2012 Ж’e Se 32 Ж’e akpa 2 lia me Е‹u.","In his sentenced letter, the action of this man is against the Ekiti Children's Foundation law which was made in 2012 Act 32 section 2.","In his sentencing letter, the manвЂ™s action contravened the Ekiti ChildrenвЂ™s Association Act enacted in Section 32 of Act 2012 .",0.92138671875
Ame aЙ–ewo tiae be yewoaК‹u ayi teЖ’e bubuwo le susu siwo tae.,Some individuals choose not to migrate to other areas due to personal reasons.,Some people choose to move for reasons.,0.80126953125
AsrГЈdЙ”lГ©kui sia ate Е‹u akaka Й–e amegbetЙ”wo me to nudzodzoe siwo Е‹u dЙ”lГ©lea le Ж’e Й–uЙ–u me.,The malaria parasite can be spread to humans through bites of infected mosquitoes.,This malaria virus can spread to humans through the bite of infected mosquitoes.,0.90673828125
Vevesese sia ate Е‹u axЙ” miniti alo gaЖ’oЖ’o К‹Й› aЙ–ewo hafi wГІaЙ–e eye woate Е‹u azГЈ atike aЙ–ewo atsЙ” aЙ–e vevesese sia dzi akpЙ”tЙ” hena ЙЈeyiЙЈi aЙ–e.,This pain may take a few minutes or hours to resolve and some medications can be used to relieve this pain for a while.,This pain may take a few minutes or hours to go away and some medications can be used to temporarily relieve this pain.,0.96435546875
Ajumako dukЙ”meviwo Ж’oe Й–e enu be woawЙ” dЙ” aduadu kple nutoa me dziЙ–uЙ–ua be woatsЙ” atsi aЙ–itsi Ж’e kaka nu.,The people of Ajumako have urged to work together with the local government in order to combat the spread of measles.,He urged the people of Ajumako to work in partnership with the local government to combat the spread of measles.,0.935546875
EhiГЈ be sukudodokpЙ”kpЙ”wo nanЙ” dzadzraЙ–oЙ–i bliboe be woate Е‹u asrЙ”Мѓ nu tso sukudЙ”wЙ”Ж’ewo Е‹u.,School labs need to be fully equipped to handle Chemistry lessons.,Academic examinations need to be fully equipped in order to learn about academic institutions.,0.357666015625
DziЙ–uЙ–umegГЈwo Ж’e hamemetsiwo nye dukЙ”a Ж’e nuto vovovowo.,Members of parliament represent different regions of the country.,The cabinet members are from different regions of the country.,0.6875
"Nya siawo tsЙ”a agbemenusЙ”srЙ”Мѓ kple nunya veviwo Й–e asi. Ne ГЁhe to na wГІ gЙ”me la, ГЁЖ’oa fu Й–e wГІ dЙ”gbo me. Nenema ke nunЙ”la la nЙ”a anyi Й–e adzЙ”ge be yeЖ’e du namu, anye eЖ’e akpa aЙ–e.","These sayings carry important life lessons and wisdom. If you punish your bottom, you flatulate in your stomach. Similarly, the priest sits aloof for his town to collapse, he will be part of it.","These words carry valuable life lessons and wisdom. When you punish your bottom, you fuck up in your stomach. Similarly, the priest sits aside for his city to fall, to be part of it.",0.8271484375
"Ke boЕ‹ ЙЈeaЙ–ewoЙЈi la, dЙ”lГ©lea te Е‹u Й–ea eЙ–okui fiana vie alo Й–ea dzesiwo fiana be eya hГЈ li.","Instead, sometimes the disease can manifest itself slightly or show symptoms to indicate that it is also present.","Instead, sometimes the disease can be mild or show signs of its presence.",0.86279296875
NuЙ–aЙ–avi bubuwo akpe Й–e Е‹uwГІ be woakpЙ” nutoa me ta.,Alternative cooking sources help to preserve the environment.,Other cooks will help you to protect the environment.,0.78271484375
Wode kpovitЙ” aЙ–e gaxЙ” me le esi wГІzГЈ adzЙ”xelawo Ж’e ga le mЙ” gbegblбєЅ nu le ЙЈleti si va yi me. ta.,A certain officer was imprisoned for misusing taxpayers money last month.,A police officer was jailed for misappropriating taxpayersвЂ™ money last month. head.,0.82568359375
"Fifia, ne ame akpa gГЈtЙ” kpЙ” dzesi dzД© sia la, wokpЙ”a lЙ”lЙ”Мѓ, Е‹usбєЅ kple Й–ekawЙ”wЙ”.","Now, when most people see this red symbol, they see love, strength and togetherness.","Now, when most people see this red symbol, they see love, power and harmony.",0.97412109375
"Wo dometЙ” aЙ–ewoe nye hadЙ”wЙ”lawo Ж’e agbanЙ”amedziwo, gake ne Й–eko wГІbia la, dzi dzea eme.",Some raised issues are company obligations but all he's asking for is calmness.,"They include partner responsibilities, but he is satisfied if he just asks.",0.415771484375
Menye teЖ’e Й–e sia Й–e si le dukЙ”a me lae sЙ” be woatu xЙ”a o.,Not every place in the country is suitable for construction of the borehole.,Not every location in the country is suitable for construction.,0.755859375
Dzila aЙ–ewo mexЙ”a wo viwo be woaЖ’o asa na alakpanyawo atike vЙ”МѓЙ–iwo o.,Some parents didn't take their children for immunization upon rumours of fake drugs.,Some parents do not take their children to avoid lies drugs.,0.72216796875
WoЙ–o aЙ–aЕ‹u na Й–eviwo be woasrЙ”Мѓ nu tso sukudede Е‹u.,Children are advised to be positive about education.,Children are advised to learn about education.,0.80908203125
TЙ”dziК‹ua dze anyi le ta la me eye ame geЙ–e ku.,The ferry capsized in the lake and killed a number of people.,The boat capsized in the lake and many people died.,0.90283203125
Tsi dzadzЙ›a akpe Й–e mГ­a Е‹u mГ­awЙ” avu kple dЙ”lГ©le siwo tsoa tsi me.,The clean water will help in the fight against waterborne diseases.,The clean water will help us fight waterborne diseases.,0.974609375
"Ne amesiwo le liЖ’oa dzi dometЙ” Й–eka Й–ee Й–a gЙ”Мѓ hГЈ la, egatsina ake.","Even when one of those sharing the boundary uproots it, it grows again.","Even if one of the border residents removes it, it grows back.",0.65234375
WotsЙ”a gbemelГЈ saa vЙ”e eye esia fia AboakyertЙ”wo Ж’e azГЈЙ–uЙ–u Ж’e gЙ”medzedze.,The bushbuck is sacrificed and this signifies the start of the Aboakyer festival.,Wild meat is sacrificed and this marks the beginning of the Aboakyer festival.,0.79638671875
"Le nyadzЙ”dzЙ”wo me la, nudzЙ”dzЙ” wЙ”nublanui sia dzЙ” le FianyЙ”nua Ж’e aЖ’eme. FianyЙ”nua Ж’e Е‹kЙ” Е‹utЙ”Е‹utЙ”e nye Elizabeth Alexander Mary Windsor.","In the news, this sad incidence occurred at the Queen's house. The Queen''s actual name is Elizabeth Alexander Mary Windsor.","In the news, the tragedy unfolded at the QueenвЂ™s residence. The Queen's real name was Elizabeth Alexander Mary Windsor.",0.8486328125
DukplЙ”la wЙ” takpekpe eye wodzro dedienЙ”nЙ”nyawo me le Ghana Ж’e dЙ›wo dzi.,The president held a meeting to discuss security lapses on the Ghanaian borders.,The President held a meeting and discussed security issues on Ghanaian soil.,0.91259765625
Abe alesi aЖ’etЙ” tsitsia gblЙ” nya sia kple gbe bЙ”bЙ”e ene la: geЙ–e wu na eЙ–okui wu eЖ’e zЙ”hЙ›: eye esi wГІzi Й–oЙ–oe ЙЈeyiЙЈi kpui aЙ–e le ema megbe la: Oliver bЙ”bЙ” nЙ” anyi kpoo.,As the old gentleman said this in a low voice: more to himself than to his companion: and as he remained silent for a short time afterwards: Oliver sat quite still.,As the old gentleman said this in a low voice: more to himself than to his companion: and when he was silent for a moment afterwards: Oliver sat still.,0.9833984375
"Nu si wowЙ”na na vidadaa kple vidzД©a enye be, wonaa gbetike wo be woano ale be vidadaa kple Й–evia nakpЙ” lГЈmesбєЅ nyui.","What they do for the mother and the baby is that,they give them herbal medicine to drink so that the mother and child will have good health.",The mother and baby are given medicine to drink to keep the mother and baby healthy.,0.6015625
"Ametsitsiwo, dЙ”nЙ”wo, kple ame akpe aЙ–ewo abe Е‹kuagbГЈtЙ” Akua Mansa kple Akosua Serwaa si xЙ” Ж’e 90 ene gblЙ” be vovo mele yewo Е‹u kura ne wole atike dim o","The elderly, the sick, and some thousands like 90-year-old blind Akua Mansa and Akosua Serwaa say they are very busy when it comes to seeking treatment.","The elderly, the sick, and thousands of people like blind Akua Mansa and 90-year-old Akosua Serwaa say they are very busy when it comes to seeking treatment",0.9677734375
"Ne edze Ж’oЖ’o Й–e edzi la, ate Е‹u atso amea Ж’e nuЙ–uЙ–u kple ami Ж’e Ж’uЖ’oЖ’o gbЙ”.","When it starts to build up, it may be caused by the person's diet and fat accumulation.","If it starts to build up, it can be caused by a combination of the personвЂ™s diet and fat.",0.9404296875
"Le Ж’e 1964 me la, Nkrumah yi DukЙ”wo Ж‘e DЙ”wЙ”wЙ” ГђoЙ–o Ж‘e Adre Na DukЙ”wo Ж‘e XЙ”tudЙ” Kple DЙ”wЙ”wЙ” Ж‘e DЙ”wЙ”wЙ” Ж‘e DЙ”wЙ”wЙ” Ж‘e DЙ”wЙ”wЙ” Ж‘e DЙ”wЙ”wЙ” Ж‘e DЙ”wЙ”wЙ” me, eye wГІgblЙ” be suku vevitЙ” si wЙ”a dЙ” le Е‹gЙ” tsЙ” wЙ”wЙ”m la gbЙ” eye wГІbia be woakeke suku bubuwo Й–e edzi.","In 1964, Nkrumah brought forth the Seven Year Development Plan for National Reconstruction and Development, which identified education as a key source of development and called for the expansion of secondary technical schools.","In 1964, Nkrumah went to the launch of the Seven-Year National Action Plan for National Building and Construction, stating that the main front-line school had been reached and calling for the expansion of other schools.",0.77685546875
