text,ref,translated,similarity_score
"TsГЈtЙ”a nyea agbanЙ”amedzinЙ”la nenema ke le afisiafi si wotsЙ”e da Й–e sinimaЙ–eЙ–e me - (eЙ–anye nugbugbЙ”gbugbЙ”, gbЙ”dЙ”dЙ”, awu Й–eЙ–e le eЖ’e awudzraЙ–oЖ’e alo nu bubu aЙ–e si le abe ema ene o.) Ema hГЈ eye wГІna wonyae nyuie le sinimawЙ”Ж’ewo.","The former used to be equally obliging wherever she was placed in filming - (whether kissing, having sex, undressing in her wardrobe or something else like that.) That too and made him well known in the film industry.","The former is equally liable wherever he is cast on film - (be it kissing, having sex, taking clothes out of his wardrobe or something like that.) That too and made him well known in the film industry.",0.75390625
"NyateЖ’ee, ga nye nusi ame sia ame hiГЈ le eЖ’e agbe me be wГІate Е‹u aЙ–Й” nuwo Й–o.","Of course, money is something that everyone needs in their life in order to make things right.","Of course, money is something everyone needs in their life to make things right.",0.9912109375
Ame aЙ–ewo hГЈ yЙ”nЙ› be Tanogbe.,Some also call it the Tano language.,Some people also call it Tano language.,0.982421875
Agbledela geЙ–ewo adze le wo Й–okuiwo si to Й–eЙ–efia sia dzi.,More agriculturalists will get exposure through this exhibition.,Many farmers will be automatically exposed by this exhibition.,0.8515625
NuЖ’oЖ’o tбєЅ Ж’e habЙ”bЙ” siwo le sukuwo fia nu sukuviwo tso Ж’ewuiwo Ж’e ЙЈeyiЙЈia Е‹u.,Straight talk clubs in schools have educated students about the adolescent stage.,Direct speech clubs in schools teach students about the adolescent period.,0.71923828125
"AzЙ” hГЈ, ne xewo va le nu gblбєЅm le agblea Е‹u to nukuwo Й–eЙ–e me la, vЙ”vЙ”Мѓdonu aЙ–e dada Й–e afima ado vЙ”vЙ”Мѓ na wo.","Also, when birds take to disturbing the farm by uprooting the crops, putting a scarecrow there will scare them away.","Also, if birds are starting to damage the field by picking crops, placing a scarecrow will scare them away.",0.94580078125
"Zi geЙ–e la, amedzro siwo va srГЈa wo kpЙ” la kpЙ”a dzidzЙ” ne woyi teЖ’e yeyewo hena fefe siwo wowЙ”na le duta. Ele be bЙ”lЖ’oha la natu amedzrodzeЖ’e siwo ame siwo doa vivi Й–e bЙ”lЖ’oЖ’o Е‹u anЙ”.",Visiting fans usually have fun when they go to new places for away games. The football club should build hotels where the fans can stay.,Visiting guests are often excited to go to new places for away shows. The football team needs to build hotels for fans.,0.83203125
Amesiwo dze egЙ”me hГЈ doa alЙ” Е‹gЙ”yiyi Ж’e Й–oЙ–o siwo wowЙ”na le woЖ’e nutoawo me la Ж’ГЈ.,The initiators also barely support the development programs in their communities.,The initiators also rarely support development initiatives in their communities.,0.8955078125
AkЙ”ntabubu le vevie Е‹utЙ” le dЙ”wЙ”Ж’e.,Accountability is so important in a work place.,Accountability is very important in the workplace.,0.9296875
"KpovitЙ”wo Й–e gbeЖ’ГЈ hГЈ be woaxe fetu si nye GHC2,000.00 na amesiame si ateЕ‹u akpeЙ–e wo Е‹u be woanya susu si tututu ta wГІwЙ”e nenema, si na wolГ©e.","Police have also announced a reward of GHC2,000.00 for anyone who can help them find out the exact reason why he did that, that has caused his arrest.","Police have also announced a reward of GHC2,000.00 for anyone who can help them ascertain the exact motive, leading to his arrest.",0.87060546875
AК‹awЙ”wЙ” le anyigba ta gakpЙ”tЙ” le amewo dome le kЙ”Ж’enutowo me.,There are still land conflicts among people in the rural areas.,There is still fighting over land in rural areas.,0.94921875
DziЙ–uЙ–ua mena ga be woatu mЙ” aЙ–ewo le nuto aЙ–ewo me o.,The government does not allocate funds to construct some roads in some areas.,The government did not provide funds to build some roads in some areas.,0.91748046875
Ele be nutome la naxЙ” senyalawo Ж’e Ж’uЖ’oЖ’o aЙ–e be wГІafia mЙ” wo le senyawo me.,The district should recruit a legal team to guide them in legal processes.,The district should hire a legal team to guide them through the legal process.,0.93994140625
"Le Е‹keke К‹ee siwo va yi me la, elektrikЕ‹usбєЅ do go kuxi siwo wЙ”e be amesiwo di be yewoaЖ’le akaЙ–iwo mete Е‹u kpЙ” Й–eka o.",In the past few days electricity has been facing problems that have prevented those who want to buy lights from getting one.,"In the past few days, electricity has faced problems that have prevented prospective buyers of lights from getting one.",0.970703125
"Enye fefe dodzidzЙ”name aЙ–e. Ha siwo wodzina le fefea me la dometЙ” aЙ–ewoe nye ""Pempenaa, Nanaa!KpЙ”, kpЙ”, kpЙ”, kpЙ” dada koo..."". WoЖ’onЙ› zi geЙ–e le Е‹dЙ” me.","It is an interesting game. Some of the songs sing during the game is in session is ""Pempenaa, Nanaa!See, see, see, see dada koo..."". It is mostly played in the afternoon","It was an interesting game. Songs in the game include ""Pempenaa, Nanaa!Look, look, look, just look at my mother..."". It is often played in the afternoon.",0.7900390625
"KplЙ”la siwo tso Nadowli-Kaleo Nutome, Bulisa, Jirapa DudzikpЙ”ha, kple Talensi Nutome Ж’o Ж’u lЙ”Мѓ be yewoawЙ” dЙ” abe Ж’uЖ’oЖ’o ene.","The leaders from Nadowli-Kaleo District, Bulisa, Jirapa Municipal Assembly, and Talensi District together agreed to work as a team.","Leaders from Nadowli-Kaleo District, Bulisa, Jirapa Municipality, and Talensi District collectively agreed to work as a team.",0.986328125
Coronavirus dЙ”vЙ”Мѓa gblбєЅ nu le dukЙ” bliboa Е‹u vevie eye dukЙ” bliboa awЙ” aК‹a kple coronavirus dЙ”vЙ”Мѓa le mГ­aЖ’e dua me.,The whole country is highly affected by the coronavirus pandemic and there will be a national fight against the coronavirus pandemic in our town.,The entire country has been hit hard by the coronavirus pandemic and the entire nation will fight the coronavirus epidemic in our city.,0.90771484375
"ЕЉutsuawo nedzi hadzidzi, Eye nyЙ”nuwo nenЙ” ЙЈe Й–um.","Let the men do the singing, and the women do the dancing.","Let the men sing, And let the women dance.",0.90380859375
Anyigba Е‹uti nyaК‹iК‹liawo na amewo bu amewo Ж’e agbe kple nunЙ”amesiwo le Agona Swedru,The land disputes resulted in loss of lives and properties in Agona Swedru,The land disputes have resulted in loss of life and property in Agona Swedru,0.97314453125
Nkyinkyim nye nyakpakpa aЙ–e si le FantetЙ”wo Ж’e Е‹utinyawo me si le abe nuwЙ”wЙ” si Ж’e nЙ”nЙ”me le abe zigzag ene. WoxЙ”e se be ekpЙ”a teЖ’e kЙ”kЙ”ewo ta eye be ekpЙ”a ame ta le gbЙ”gbЙ” me.,"Nkyinkyim is a mythical creature in Fante folklore that takes the form of a twisted, zigzag-shaped creature. It is believed to guard sacred places and is associated with spiritual protection.",Nkyinkyim is a mythical figure in Fante folklore that looks like a zigzag-shaped creature. It is believed to protect holy places and to provide spiritual protection.,0.98291015625
"Vevienyenye aЙ–ewoe nye, ekpena Й–e mГ­a Е‹u mГ­enya alesi xexeame le zЙ”zЙ”m, ekpena Й–e mГ­a Е‹u mГ­eЙ–oa dze kple dukЙ” vovovowo, enaa mГ­ekpЙ”a dzidzЙ” kple bubuawo.","some of the importance are, it helps us to know how the world is moving, it helps us to communicate with different peoples, makes us happy and so on.","Some of the importance are, it helps us to know how the world is moving, it helps us to communicate with different countries, it makes us happy and so on.",0.953125
DziЙ–uЙ–udЙ”wЙ”lawo Ж’e HabЙ”bЙ” gblЙ” le kpekpe aЙ–e si wowЙ” tsЙ” dzro fetu dzi Й–eЙ–e kpЙ”tЙ” Ж’e aЙ–aЕ‹uЙ–oЙ–oa me be yewole te sesД©e.,The Association of Government Workers stated at a meeting held to discuss the salary increment proposal that they firmly stand their ground.,The Government Employees Union said at a meeting to discuss the salary increase proposal that it stands firm.,0.79248046875
Nutomea Ж’e Е‹gЙ”nЙ”la xЙ” dzЙ”la yeye Й–e dЙ” me le asi me.,The district leader has employed a new watchman in the market.,The district leader employed a new guard at the market.,0.83740234375
Ele be mГ­ana xЙ”seha siwo le nutoa me nakpЙ” gome le sЙ”hЙ›wo Ж’e gbЙ”dЙ”dЙ” Е‹uti nufiafia me.,We should involve the local faith communities to educate the youth about sex education.,We need to involve local faith communities in youth sexuality education.,0.88720703125
"AzЙ” hГЈ, ele tsi Й–evia, dzraa eЕ‹u Й–o eye wГІnЙ”a fofoa Ж’e Ж’ometЙ”wo lalam.","Also, she baths the child, dressed and wait for the family of the father.","She also bathes the child, cleans him, and waits for his father's relatives.",0.84765625
Woadzro dЙ”lГ©le sia Ж’e afЙ”kuwo me eye woakpЙ” egbЙ”e.,The dangers of this disease will be assessed and remedies will be provided.,Risk factors for this disease will be discussed and managed.,0.755859375
Nu gbegblбєЅ wЙ”wЙ” dometЙ” Й–ekae nye ale si amewo wЙ”a nu vlo wЙ”wЙ” le mГ­aЖ’e hatsotsowo me tЙ”wo nye be womehea nu gbegblбєЅ vЙ› o.,One of the causes of crime in our communities is poor upbringing.,One of the negative aspects of how people commit crimes in our classes is that they do not cause negative effects.,0.513671875
KЙ”nu sia bia be woatsЙ” anyi dzД© (Akpade) atre К‹Й”tru eve siwo le eЖ’e axawo dzi le FiЙ–a si nye Twins Yam ЕЉkekenyui dzi.,This rite involves plastering two side doors with red clay (Akpade) on the Friday of the Twins Yam Festival.,This ritual involves sealing the two doors on its sides with red clay (Akpade) on the Friday of the Twins Yam Festival.,0.91064453125
Nublanuinya aЙ–e dzЙ” Й–e nyЙ”nu aЙ–e si xЙ” Ж’e wuiatЙ”Мѓ (15) dzi le Konongo le Ashanti nutoa me.,A sad thing has happened to a lady of the age fifteen (15) in Konongo in the Ashanti region.,A tragedy struck a fifteen (15) year old woman in Konongo in the Ashanti region.,0.83251953125
Ele be woanЙ” dЙ”nЙ” siwo le nЙ”nЙ”me sesбєЅ aЙ–e me la Ж’e nЙ”nЙ”me nyuitЙ” me nanЙ” nЙ”vi siwo le kЙ”dzi.,Patients in a critical state should be given priority in the hospital.,Patients in a critical condition should be kept in the right position by the brothers in the hospital.,0.62060546875
Katoliko-ha la ana asigЙ› nunЙ”lawo le Ebola dЙ”vЙ”Мѓa dome.,The catholic church will provide gloves to the priests amidst the Ebola outbreak.,The Catholic Church will give bracelets to priests amid the Ebola outbreak.,0.76953125
"Ne Ж’omea me tЙ” bubu yi anyigbaa dzi la, esia ana woanya be ame aЙ–e va afima xoxo.","When another family member goes to the land, this will communicate to them that someone has already been there.","If another family member visits the property, this will let them know that someone has already been there.",0.708984375
"GhanatЙ” asitsala si xЙ” Ж’e 43 si le UK, Enerst Kwaku Kobeah, na wonya eЖ’e tameЙ–oЙ–o le NDC Ж’e aflaga Ж’e hoК‹iК‹li Е‹u.","Ghanaian business man aged 43 who lives in UK, Enerst Kwaku Kobeah, has made his intentions about contesting for the NDC flagbeareship known.","A 43-year-old UK-based Ghanaian businessman, Enerst Kwaku Kobeah, has made his intentions on the NDC flagship contest known.",0.70654296875
"Wona tsyЙ”Мѓevi alafa Й–eka blaatЙ”Мѓ susЙ”eawo le nutoa me, eye woawo hГЈ xЙ” sukudЙ”wЙ”nuwo kple sukunudidiwo.",One hundred fifty orphans have been given scholarships in the district and they also received scholastic materials and school requirements.,The remaining one hundred and fifty orphans in the county were given school supplies and supplies.,0.77587890625
WoaЙ–o Е‹ku ame siwo le Е‹utinya me la dzi le woЖ’e  akpa si wowЙ” na dukЙ”a ta.,The historicals will be remembered for their contributions towards the country.,People in history will be remembered for their contributions to the country.,0.9208984375
ГђewohД© Ж’e sia Ж’e azГЈЙ–uЙЈi madzЙ” dzi na ame abe alesi wГІnЙ”na Й–aa ene o elabena wode se Й–e dutoЖ’o kpekpewo nu,This year's festive season may not be as exciting as usual since public gatherings have been banned,This yearвЂ™s festive season may not be as exciting as usual as public gatherings are prohibited,0.91552734375
"De Е‹ugble le nu nyui siwo dzЙ” le wГІ agbe me Е‹u, eye nГ kpЙ” dzidzЙ”.","Think a lot about the good things that have happened in your life, and be happy.","Reflect on the positive things in your life, and be happy.",0.9345703125
ЕЉutsuwo kple nyЙ”nuwo kple hadomeЕ‹gЙ”yiyi Ж’e dziЙ–uЙ–umegГЈ tsГЈtЙ” bu si na be hadomeЙ–oЙ–oa do kpo nu.,The former minister of gender and social development disappeared which made the partnership fail.,The former minister of gender and social development disappeared leading to the failure of the partnership.,0.97802734375
"Ame sia ame, ame tsitsi alo Й–evi ate Е‹u aЙ–u abЙ”bЙ”wo.","Snails can be eaten by anyone, adult or child.","Anyone, adult or child, can eat bananas.",0.52685546875
"KpovitЙ”wo Й–e gbeЖ’ГЈe le radiodЙ”wЙ”Ж’ewo be amewo nade dzesi ame kukua, esi wole numekuku wЙ”m be yewoakpЙ” nyi siwo wofi siwo dziЙ–uЙ–ua na la.","The police announced on radio stations for people to identify the body, as they carry out investigations to recover the stolen cattle provided by the government.","Police issued a radio broadcast asking people to identify the body, as they investigated to recover the stolen government-issued cattle.",0.93115234375
Wo dometЙ” Й–eka ate Е‹u awЙ” nu vevii eye wГІakpЙ”tЙ” anye ame bubuwo tЙ”.,One can be disabled and still live a normal life like others.,One of them can hurt and still belong to others.,0.2685546875
Wodzroa dЙ”wЙ”la nyui aЙ–e le ale si wГІtea Е‹u wЙ”a dЙ”e ta.,A good worker is evaluated on the basis of his or her performance.,A good employee is sought after because of his ability to work.,0.73681640625
"Twigbe gbГЈtЙ” si woЕ‹lЙ”e nye Akuapem Twi, eye eyae nye gbe gbГЈtЙ” si me woЕ‹lЙ” ЕЉЙ”Е‹lЙ” KЙ”kЙ”eawo le Twi me.","The first written language of Twi was Akuapem Twi, and it was the first language in which the Holy Scriptures were written in Twi.","The first written Twi was Akuapem Twi, and it was the first language in which the Holy Scriptures were written in Twi.",0.98876953125
Ame etЙ”Мѓ bu woЖ’e luК‹Й” le afЙ”ku gГЈ aЙ–e si dzЙ” le Sunyani Techiman mЙ” dzi me.,Three people have lost their souls in a fatal accident which occurred at the Sunyani Techiman road.,Three people lost their lives in a major accident on Sunyani Techiman road.,0.78125
Ele be nutome gГЈ dziЙ–uЙ–umegГЈwo naЙ–e asi le woЖ’e masЙ”masЙ”wo Е‹u eye woawЙ” dЙ” le mЙ”awo dzi.,The district officials should put their differences aside and work on the roads.,The provincial authorities should drop their differences and work on the roads.,0.81689453125
"Nye nyinЙ”wo Ж’e akpa gГЈtЙ” dzea dЙ”, WolГ©a Е‹ku Й–e woЖ’e lГЈmesбєЅ kple woЖ’e lГЈmesбєЅ Е‹u.","Most of my cows are diseased, posing a challenge for their proper care and well-being.","Most of my cows get sick, They check their health and fitness.",0.76123046875
Fififi Ж’e seselelГЈme nЙ”a esi ale gbegbe be eЙ–ua nu Й–e вЂ‹вЂ‹eme be yeawu fififi la Е‹utЙ” nu.,He gets a feeling of theft so great that he eats into it to complete the theft itself.,He has such a sense of stealing that he eats into it to finish the theft itself.,0.92333984375
"TsГЈ la, dziЙ–uЙ–ua Й–o aК‹awЙ”nu gbogbo aЙ–ewo be woaЙ–e Polio Й–a le Ghana.",Previously the government organized mass immunization to eliminate Polio from Ghana.,"In the past, the government has deployed a number of campaigns to eradicate Polio in Ghana.",0.8662109375
ViЙ–e kawoe do tso dekЙ”nu sia me?,What were the benefits of this culture?,What are the benefits of this culture?,0.88671875
